date,employee_title,location,review_title,Review,rating_overall,rating_balance,rating_benefits,rating_job_security,rating_management,rating_culture
" August 22, 2019",Lead Artist," Fayetteville, NC ",Cut throat and bad work environment,"I'd love to say everything I want to share but I'll narrow it down. The benefits were good, the pay was great, and the work/life management wasn't awful. Don't be fooled though. There is no way to move up and those in positions to help won't do so. This is very much a dog-eat-dog company, both within my prior team and others scattered across the country. All locations were working as their own machine, stealing work from other BAH teams purposefully to gain recognition and funding, and doing so in ways that were astoundingly deceptive. Besides the lack of relevant criteria to justify promotions (which nobody in leadership seemed interested in doing) there is an EXTREMELY awful work culture that encourages otherwise unacceptable behavior(s). I cannot recommend this company to anyone with good work and personal ethics, or anyone in a creative field wanting to grow. If you are looking for a nice benefits package, decent income, have prior experience in the military, and see no need in receiving acknowledgment then this is the place for you.",1,3,5,1,1,1
" August 21, 2019",Environmental Management Specialist," Durham, NC ",Great Company,Great company to work for in all aspects.The company encourages and funds career development opportunities and has a clear structure for career advancement.,5,5,5,5,5,5
" August 21, 2019","Human Capital Management Consultant, Associate"," McLean, VA ",Great place to launch your career and reinvent yourself,"Booz Allen was my first job out of college and I've been with them for 6+ years (including internships). Over the years I've seen tremendous growth in myself -- not only in the sense of functional skills, but also in my ability to solve problems, lead in ambiguity and lead teams. One of the best things about Booz Allen is the flexibility (depending on the client). I primarily worked from home for 2.5 years and was still able to feel a part of the organization while also getting promoted. Additionally, I think overall the work/life balance is great. Since the clientele are primarily government, the pace of work is much slower and less demanding as opposed to commercial clients. If you're looking for job / project stability with minimal travel, Booz Allen may be the place for you. The only caveat to that is that because of that work/life balance and fantastic benefits, the pay is not as competitive.",4,4,3,4,3,4
" August 21, 2019",Lead Associate," McLean, VA ",Horrible,"The corporate environment is completely different from the on-site work. No work life balance, nonstop micro-managing, cut throat, and horribly toxic culture. Everyone at Booz Allen corporate thinks they are entirely more important than they are and are constantly trying to assert themselves as valuable, at the expense of everyone else. It is a very catty, gossip filled environment, that cares little about actually doing what is best for the company and more about what is best for them and their goals. If you enjoy being silo'ed off based on your job title, forced to work over 40 hours a week (to keep up appearances of being busy), and have high-level people trash entire teams to make themselves look more valuble then I highly recommend a corporate position at Booz Allen Hamilton. However, if you think you are an adult, and smart, and can accomplish tasks without having to account for every second of the day then I think you should look elsewhere.",1,1,3,1,1,1
" August 19, 2019",Database Manager," Fort Knox, KY ",Work Day,"Typical day at work is reviewing over different simulation scenarios, learned about management they are very open minded about questions you ask them. Work place culture is very relaxed. Hardest part of the job is dealing with training events for the Army Reserve. The enjoyable part of the job is working with simulations.",4,4,4,4,4,4
" August 17, 2019",Systems Administrator," San Diego, CA ",Great Place to Work,Great place to work. Flexible hours are a plus at this company and depending on the team you're on the atmosphere is great. People are willing to help you in any way they can mostly.,3,4,4,3,3,4
" August 16, 2019",Lead Associate, Maryland ,Looks great on your resume!,"This experience was very, very hard, but taught me a lot. Networking is critical to survival. You may get terminated if you can't find a contract, but at least you will get warning.",4,2,4,1,2,2
" August 15, 2019",Cyber Security Engineer," San Antonio, TX ","Toxic, sexest (if you are middle age male and straight) and demoralizing","Start work between 7AM-7:30AM, log into your computer (which takes a good 10 minutes due to all the security measures they use on their networks). Dial into a teleconference, take notes end teleconference. Check emails, send emails, and look at what task you might have to do and do them. If you don't have a task, just remain in your sit and look busy. Booz Allen Hamilton just wants a warm body in their required contracted seats, then they want you to shut up and not say anything. They do a terrible job matching their human talent with enriching and motivating positon for their employees. I wouldn’t suggest my enemy to work here.",3,2,2,2,1,2
" August 13, 2019",Sr. Contract Manager," San Diego, CA ",Unsatisfied.,Was not the company for me. They spent a lot of money moving me from midwest to CA. Then dropped the ball. Company should have at lrast plaved me in my career field. Left a bad taste in my mouth. Especially when they tried to collect for moving expenses. Told them they failed to uphold their end of the agreement. End of story.,1,5,5,2,1,1
" August 13, 2019",SENIOR CYBER PLANNER," Fort Meade, MD ",Productive Fun Work Place,Booz Allen Hamilton is a professional contracting company with a great reputation. They treat all their employees with respect and there is opportunity to get educated and do the jobs you prefer.,4,4,3,4,3,3
" August 6, 2019",Program Manager," McLean, VA ","Dynamic, interesting place to work",What I appreciate most about working for Booz Allen Hamilton is the ability to collaborate cross functionally across the enterprise. Employees are empowered to reach out and build working/mentoring relationships as desired to achieve functional and personal success.,4,4,4,4,4,4
" August 5, 2019",IT Auditor," McLean, VA ",Booz,"Learned a lot from my peer, had a great time learning from my seniors, and engaging in client relations. The most enjoyable part was being able to learn from my seniors.",5,5,5,5,5,5
" August 3, 2019",Acquisitions Manager," Arlington, VA ",Booz Allen is a very poor prime contractor,"Was supervised by Subcontractor manager other than the two manager interviewers; military government manager client switched me to a different team from the one I was assigned to on my first day (this is a red flag); Booz Allen junior level associate was assigned to train me and assign me tasks vs. the government manager client who is supposed to supervise and train the contractor – not Booz Allen; Booz Allen junior level associate has an ego problem and thinks he is smarter than everyone else; military government manager client bragged about how he fired the previous Subcontractor employee in the job because she did not seem very smart (this is a red flag); Subcontractor manager put me on a performance improvement plan because he thought I am not very smart – he asked me to send him all the emails coming from Booz Allen junior level associate; Subcontractor manager came to realize via those emails that Booz Allen junior level associate was in fact the cause of the problem; Subcontractor manager could not get an in-person meeting with military government manager client easily and had to really press for that. Subcontractor manager kept trying to get performance feedback from military government manager client via email and got no response; Subcontractor manager asked me to send him an updated resume and he put me on the “no-coverage list” so I could move to a different contract. He told me Booz Allen took the job back, but the client did not have any problem keeping me. Subcontractor did schedule many interviews to try to move me to a different contract, but I was turned down",1,1,1,1,1,1
" August 1, 2019",Financial Analyst," McLean, VA ",Going through a culture change,"I have loved working for this company since I started, having great interactions with my Career and Job Managers. However, my organization is undergoing a significant shift in dynamic, along with changing accounting and firm systems, leading to unanswerable questions regarding career development, advancement/progression, that were previously well developed and established.",4,3,4,4,3,3
" August 1, 2019",Project Financial Analyst Senior Consultant," Rome, NY ",Great Place to work,"Good Place to work
Very Challenge task at times depends on the project
Great for Military personal
Flexible time to do this for your self and family
Encourages local charity events etc",4,3,4,4,4,4
" July 31, 2019","Contractor (GS-0346-13 Equivalent), Lead Associate",346,Great experience,Work was fast paced and directly supported Soldiers in the field. Very fulfilling assignment although it was a short term and the relocation was brutal.,4,4,4,2,4,4
" July 26, 2019",INSTRUCTOR/DEVELOPER," San Angelo, TX ",Typical big company,"It was your typical big company. We worked in a small satellite office, 4 hours from a major hub. We were usually forgotten about. It was an easy gig. BAH is big on training so they would send us for 40 hours of training a year. That was nice. Other than that it was like any other big company.",3,3,3,2,2,3
" July 24, 2019",Associate / Program Manager," Jacksonville, NC ",Management will believe in you,"You have to pay your dues in order to see a promotion or pay raise. If you generate more business you be viewed as a ""Rock Star"". The review process is not always fair.",2,5,2,2,2,2
" July 24, 2019","Epidemiologist, Senior Consultant"," Portsmouth, VA ",Workplace Culture,"I love the contract I'm on, but with Booz Allen the compensation is not high enough for the work that is expected of me and advancement is difficult. I am required to do much more than I am getting paid for and should get a promotion, but have not.",3,4,2,3,3,3
" July 20, 2020",Senior Data Scientist," Tysons Corner, VA ",Work culture is pretty toxic,"Work culture is pretty toxic. Junior staff are asked to put in extra hours but not allowed to bill overtime. Once you get to management, you have to be over 80% utilized in addition to putting in weekend hours to fulfill business development requirements.",4,4,3,3,3,3
" July 22, 2019",Full Stack Developer," Washington, DC ",You Define Your Experience,Booz allows you to define your own experience their based on your interests and skills. Every person will have a different experience and most teams are willing to work with you if you desire change.,4,4,5,5,4,3
" July 20, 2019",Researcher," Herndon, VA ",Consulting,I loved working for this company and I also loved what I did here. I supported about nine different finance teams and researched any payment errors or charge number issues in regards to reimbursement. We were also able to deal directly with internal and external customers.,5,4,4,3,3,4
" July 19, 2019",Senior Cyber Security Engineer," Alexandria, VA ",Very dependent on the contract,"I think anyone's assessment of Booz Allen is completely dependent upon the contract you're hired on to. My experience with Booz Allen Hamilton might completely differ from someone else. I don't have anything negative to say about Booz Allen. My leadership was very professional, and forthcoming when asked for feedback. I worked onsite for my contract so it was very much a government environment, and not a reflection of the culture at Booz.",4,4,5,3,3,4
" July 18, 2019",Senior Program Manager," Rockville, MD ",Good opportunities,"Get in the door, and there are a number of opportunities if you desire to pursue them. Flexible workplace that encourages pursuing your interests and willingness to try new areas.",4,4,5,4,4,4
" July 17, 2019",Project Manager," San Antonio, TX ",Strong company with great people,"Booz Allen is a great company. They have a very strong reputation for delivering results. Because it is a large company, there are many growth opportunities albeit, some opportunities may require relocation. Compensation is fair and benefits are good.",5,4,5,3,5,5
" July 14, 2019",Facility Security Officer (FSO)," Beavercreek, OH ",Great people who view security as a partner,The company leadership takes to time to partner with the security department. This makes the job easier and doesn't make our department feel like an outsider.,4,4,4,4,5,5
" July 13, 2019",IT Project Manager," McLean, VA ",Not Perfect but Better than most!,"I’ve worked at several smaller firms that talk a big game. However, Booz Allen seems to to be the only one that holds themselves accountable. They put their money where their mouth is and follow through on their promises almost every time.",5,3,4,3,3,3
" July 12, 2019",Lead Associate," Dayton, OH ",Good place to work,Booz Allen is a good company to work and advance through the levels as long as you put in the extra effort and time. The best part is meeting various people and building a solid network,3,3,3,3,3,4
" July 9, 2019",Senior Associate," Langley, VA ",Above Average Defense Contractor,"Best thing about Booz is their diversity of contracts. If you get in and don't like what you're doing, give it a fair shake then you'll have plenty of options to laterally move. Bad thing is that it's like a consultant factory line.",3,4,4,3,3,3
" July 8, 2019",Lead Associate/Consultant," Omaha, NE ",Great company and people,The sky is the limit when you work for this company. Only you are able to hold yourself back. The firm pushes self development and for you to explore diversifying your skills.,5,5,5,5,5,5
" July 5, 2019",Trainer/Developer/Integrator/Facilitator," Fort Stewart, GA ","The best place I have ever worked, were all A types",">0830 Prepare Classroom instruct advise client in Asymmetric warfare. If not training students, then we are creating preparing lesson plans and researching threats.

>Blended Learning

>I manage a 30 Man team across the Globe with high success

>The best place I have ever worked, were all A types

>Stress of loosing the contract

>Working with talented people with same goal of producing the best product for the US.Army",5,5,5,5,5,5
" July 5, 2019",Senior Consultant," Atlanta, GA ",Terrible culture,"Not a great culture to be a part of, lack of diversity in leadership roles, very competitive, and a very stressful place to work. Promotions are often dangled in front of you and just as quickly taken away.",2,0,0,0,0,0
" July 4, 2019",CI2C Site Lead - Asymmetric threat support team, Asymmetric threat support team (Former Employee) ,Get firm to work for!,"Loved that job and the colleges I worked with. Organizational culture was top notch. Had no intention of leaving; however, due to family issues, I needed to relocated back to Indiana.",5,0,0,0,0,0
" July 2, 2019",Contractor," McLean, VA ",Depends On Who You Work For/With,"Worked for Booz as a contractor for a year. Department fell apart after two managers moved to other positions. One woman was promoted to one of those management positions was a completely uninvolved, unresponsive manager who I talked to one on one once during my year there. Several people moved to other positions to get away from her. She's completely unprofessional, unkind, uncaring and barely even answers her email.

Then there's my coworker.....I've never worked with someone (or even known someone) so ridiculous. She's extremely unprofessional. Two or three contractors left after a couple of months stating her behavior as the reason. She spent at least half of her day, every day on IM gossiping and complaining about everyone and everything-constant negativity. When she wasn't doing it on IM, she was complaining and gossiping to other employees or anyone who happened to come in and even told new hires what a horrible company it was. If anyone said anything to her she took it as them having a fit and I knew the comment was coming as soon as they walked away. She's very good at her job and a very huge manipulator, brown noser and backstabber. Several people came to me and said ""She's horrible"", ""She's so unprofessional"". I found out some absolutely horrible and untrue things she said about me. One minute she was being friendly and the next bashing me. She did the same to everyone else. She's been warned multiple times and written up, but nothing will ever be done because nobody knows how to do her job nor care to figure it out. Too much effort.

I'm glad to be out",2,4,4,1,1,1
" June 30, 2019",Senior Associate," Washington, DC ",Heavy handed company; a shadow of it's former self,"I worked for Booz Allen twice. The first time was for 6 years, before-9/11. The second time was for just over 10 years. In that time, it became a very heavy handed company. During my first stint with Booz, it was a very innovative, smart, and agile consulting company. Certainly top shelf. Today, they lack opportunities for innovation, creativity, and growth. While they claim to “empower people to change the world.” I’ve never seen anyone change anything at Booz Allen. Banding is based on the old Booz Allen, not what exists today.

Post Snowden they setup an insider threat program to monitor employee behavior. When I was there, they made everyone sign a legal waiver to be continually monitored. This included ongoing background checks, credit checks, social media, computer, cell phone, blogs, news reports, etc.

Most work these days is “buts in seats” at government offices under the supervision of a government employee. It can be years before you even visit a Booz Allen facility. Unless you work with your manager onsite, you might only see them once a month or less. You still have to do daily time sheets, annual assessments, and other admin functions. The company no longer provides computers to new employees; no laptop, cell phone, etc. You have to use your own computer for admin functions; other than your timesheet, you can’t do Booz Allen admin functions on a government computer. For the most part, you’re a bit like a temp employee outsourced to a government agency.

Having moved on to a truly innovative company that’s really changing the world, I now see just how bad",1,0,0,0,0,0
" June 29, 2019",Associate Consultant," Norfolk, VA ",Fun Environment,"The person gets to control the ability to shift locations and tasks. Networking is a must if you want to get known and move up the ladder, otherwise expect to get into a task site and stay there.",4,3,4,4,3,4
" June 29, 2019",Talent Acquisition Specialist," Annapolis Junction, MD ",Great place to work,Have loved every second of my employment. The company culture and advancement opportunities are readily available and the sky is the limit for forward progression.,5,5,5,5,5,5
" June 29, 2019",Lead Technologist," McLean, VA ","Pretty good company, not good about promotions","The company has positive and negative aspects, they seem to be more concerned with the outside perspective of the company than the well-being of thier own employees. The benefits are good, but I have seen better at smaller companies. The best part is the cameraderie between (most) co-workers.",4,5,2,2,2,1
" June 28, 2019",Training Specialist/Manager," Mobile, AL ",Great company,I would highly recommend working for BAH. I would encourage people looking for a position to see out any openings with BAH. FIrst rate company with excellent benefits and opportunities.,5,5,5,5,5,5
" June 26, 2019",Sr. Consultant," Washington Navy Yard, DC ",TOXIC for this BFM Navy project..RUN,"As of now, the team is being run by a horrible team lead with no experience in leading a team in a highly demand client work culture. Dealing with client's demand can be stressful with constant changes, but at least understandable due to the consulting world. However, with the emotional unstable, my way or high way, ego as big as expanding universe team lead, that's SUPER tough, stressful and bad for the health of each of team member. NOT SURE what top management will do since the whole team has voiced up the issue for about a month now. Adding more members will help the long work hours (avg 10hours/day) but not addressing the above issue. It's up to the management to choose either place the lead to a different smaller/less demanding project with 1-3 team members to manage and hone the people/management skills, or risk loosing the whole team.",2,2,2,2,3,3
" July 20, 2020",Senior Data Scientist," Tysons Corner, VA ",Work culture is pretty toxic,"Work culture is pretty toxic. Junior staff are asked to put in extra hours but not allowed to bill overtime. Once you get to management, you have to be over 80% utilized in addition to putting in weekend hours to fulfill business development requirements.",4,4,3,3,3,3
" June 26, 2019",Associate," Chantilly, VA ",BAH has been a great place to work,"I have worked at BAH for over 20 years and it has been a great experience. Good pay, challenging and interesting work withgreat coworkers. Great benefits including training/tuition compensation, health including dental and vision. BAH has always been an employee focused employer with emphasis on work life balance.",5,0,0,0,0,0
" June 26, 2019",Program Manager," Fort Bragg, NC ",The People at Booz Allen Hamilton are among the best,I have enjoyed working with my fellow employees and supervisors at Booz Allen Hamilton. The company attracts and hires some of the best employees in the industry. The culture is very accepting and everyone is very honest and open. I was able to hire 19 folks to work on our project and was given full latitude to make the necessary calls. I will continue to work with Booz Allen and recommend them to any future candidate.,5,5,4,4,4,5
" June 26, 2019",Information Security Engineer," McLean, VA ",Overall good experience,Pretty good place to work depending on the project and contract you're working on. Atmosphere is pretty relaxed and overall experience is amazing however it seems that compensation lacks over time but depending on project/contract work/life balance is pretty good and even remote positions available.,5,5,3,5,5,5
" June 25, 2019",Senior Consultant," McLean, VA ",Some good some bad,"Booz Allen is a sometimes stimulating, sometimes isolating experience. Much of your experience will be based on the team you happen to be placed on, the managers you are allocated, and the type of work you get.",3,0,0,0,0,0
" June 19, 2019",Associate," Fort Carson, CO ",Great place to work.,"Great, professional environment! I've enjoyed the environment with great local leadership. Advancement opportunities are there but in many cases require relocations.",5,5,5,4,4,4
" June 19, 2019",Security Coordinator," McLean, VA ",Great Experience,Worked in VA but left company to move to Upstate NY for a different job. Everyone working there was friendly and everybody had their job to complete. Company really appreciated the employee and respected their time.,5,4,4,5,4,4
" June 18, 2019",Sr security administrator, Panama City Beach FL ,First company to help people in need.,Very impressed how the company helped hurricane michael survivors. Employees freely gave those in dire need their leave to cover time off after total destruction of homes.,5,5,5,5,5,5
" June 15, 2019",SENIOR CONTRACTS ADMINISTRATOR," McLean, VA ",Excellent organization,Excellent organization to work for. Really dedicated to the client's mission. Client is # 1 priority. You will definitely find a purpose. Salary is fair and commensurate to the client engagement. Be flexible...you are needed.,5,5,4,4,5,5
" June 13, 2019",Software Engineer," Chantilly, VA ",Great company to work for.,This is the best company to work for. They really take care of their employees and try to hire within. The benefits are great and so is the work environment. I am happy to work there.,5,5,5,5,5,5
" June 12, 2019",Industrial Security Representative," Panama City Beach, FL ",Productive work environment.,"Enjoyed my work, the employees and my customers. Enjoyed my travels to headquarters for annual security meetings. Security audits were very stressful, but always passed with flying colors.",4,4,4,3,3,4
" June 11, 2019",FEDSIM PCO/Consultant (L1)," McLean, VA ",Strong and Generous,"I applaud the immense efforts of this global organization to build a unique brand. Although a fairly new addition, there is a mandatory 2 day program on the culture alone.

Booz Allen promotes work/home balance with: telecommuting, mentoring programs, physical, mental & financial wellness resources, continuing education options, opportunities to join volunteer groups, in-house daycare, campus construction updates for parking options (you can expense!), cash awards for participating in monthly challenges, shopping discounts & perks, access to discounted legal services, identity protection and pet insurance to name a few.

As their story reads, ""our purpose and values are more than just words, we empower people to change the world.""",5,5,5,4,5,5
" June 11, 2019",Technical Editor," Springfield, VA ",Compensation not as high as it can be and management could improve communication and coordination.,"The particular roles and duties of the position were different than advertised. Job was more tedious than expected, and management sometimes was not on same page with the customer, such as when employees were prevented from entering secure site due to a communication snafu.",3,3,3,4,3,3
