date,employee_title,location,review_title,Review,rating_overall,rating_balance,rating_benefits,rating_job_security,rating_management,rating_culture
" November 29, 2019",Senior Associate," Mclean, VA ",Not what is used to be,Agree with others. New management has put a premium on change but has given zero guidance or assistance once changes are made. They lack vision and work their best employees into the ground and pay no attention when they broach the subject of workload and responsibilities. I have worked for Booz for over a decade and I can't get out fast enough.,1,1,1,1,1,1
" November 25, 2019",Internship," Washington, DC ",Relaxed workplace but expects excellence,"I have had two summer internships with BAH and both were amazing experiences. Telecommuting was an option, the offices provided snacks and a comfortable environment.",5,5,5,5,5,5
" November 24, 2019",Software Engineer," San Diego, CA ",Has been a good place to work so far...,"As with all Government contracting, it seems it all depends on what contract you're put on. Government contracting seems to use kind of old tech which can be problematic moving on from them. There also seems to always be a lot of bureaucracy to deal with.

As far as contractors they're probably one of the most desirable ones to work with. They don't ditch you if they don't have a contract for you to jump onto (pro and con really).

One key thing to note is if you're being hired for the bench. I didn't realize I was not going straight onto a contract so it was a bit nerve-racking not being on a billed contract. The bench refers to employees they have on the payroll that aren't being billed to a government contract but they like to have some people there as they want to put people straight onto a contract as contracts come up.

Benefits:
401k: 6% match
PTO: 3 - 4 weeks depending on what level you're being hired on as
Education Benefits: 5k starting out a year toward relevant training/education
Bonus: So far only bonus I've seen is 150$ every quarter for random company-wide pushes to make employees healthier, financially secure, etc... Last one you had to fill out a workout tracking for 60 hours or so. (pretty easy)",4,3,4,3,4,4
" November 21, 2019",Senior Sourcer," Springfield, VA ",Enjoyable Work Environment,I highly recommend Booz Allen Hamilton! As a Sourcer we had tremendous work life balance and the leadership definitely understood the complexities of recruiting and sourcing for very hard to fill roles.,4,5,3,4,5,5
" November 18, 2019","Cloud Architect/Engineer, Mid"," Arlington, VA ",Very productive and relax work environment.,I enjoyed working at Booz Allen and Hamilton. It is a company I would recommend to anyone to work for. I was exposed to many IT tools and technology. It made me a very well knowledgeable IT Staff Technologist.,5,5,5,5,5,5
" November 16, 2019",Technical Lead," Charleston, SC ",Unprofessional envrioment,"This place has high turnover for mismanagement employees and childish behavior from management. Hard to tell when they are being adult or kids. Don't expect to be in a professional environment, nepotism selfishness thrives.",1,1,3,1,1,1
" November 16, 2019",Database Administrator," McLean, VA ",Difficult to get Work/Life Balance but Lots of Opportunities to learn,They have lots of job opportunities at BAH. My issue with this company is that they don't have a separate team for contracts so the project team becomes the contract team when you have to recompete. I found BAH to perpetually ask me to put in more time for administration and contract support that was not billable.,3,1,4,4,3,2
" November 15, 2019",Software Developer," O'Fallon, IL ",Least favorite defense contractor,I would NOT recommend working at this company. There are so many other government contractors out there. Highly recommend choosing a different one to work at.,1,1,1,1,1,1
" November 15, 2019",Accounting Manager," McLean, VA ",Flexible hours and work from home.,"I love working at Booz Allen Hamilton. It is a great company for working mothers with Flexible hours, Job Work/Life Balance, Job Security/Advancement, and work from home.",4,4,4,4,4,4
" July 20, 2020",Senior Data Scientist," Tysons Corner, VA ",Work culture is pretty toxic,"Work culture is pretty toxic. Junior staff are asked to put in extra hours but not allowed to bill overtime. Once you get to management, you have to be over 80% utilized in addition to putting in weekend hours to fulfill business development requirements.",4,4,3,3,3,3
" November 14, 2019",USAOG HUMINT Senior Foundry Instructor," Fort Hood, TX ",Collaborative and Rewarding Place to Work,Enjoyed my time with BAH and would love to find another position there again some day even if it's par-time or telework. The benefits and compensation only adds to the work experience in a positive way.,5,5,5,3,4,5
" November 13, 2019",Executive Assistant," Norfolk, VA ","Ethical, inclusive, integrity, values","This is a company that actually practices their vision, mission and values. It isn’t talk, it IS the company. Integrity, empowerment, ethical, honest ... just a few words that come to mind when I think of my employer, managers, and management.",5,5,5,5,5,5
" November 13, 2019",Principal & Distinguished Technologist," Washington, DC ",Great place to work but very much federal contracting mindset,"Great place to work but very much federal contracting mindset. If you are interested in a technology oriented job, then this is not the best place to work.",4,3,3,3,3,3
" November 12, 2019",Associate secretary," Chicago, IL ",Long hours. Outstanding company and very professional,Wish I had stayed working for Booz Allen Hamilton. Left because I had a young child. Actually enjoyed commute. Long hours at times. Compensated well. Staff very professional.,5,4,4,4,4,4
" November 12, 2019",lead Information System Security Manager," Rockville, MD ",Great!,"Great culture, I love this company. Great place to develop and learn more about the industry. People are always willing to assist you and show you new and innovative ways to approach your daily task.",5,5,5,5,5,5
" November 11, 2019",Principal," McLean, VA ",Fantastic company,"* Great place to begin a career
* Mission-focused, and provides the opportunity to contribute to our country's most vital endeavors
* You will get out of Booz Allen as much as you put into it
* Booz Allen will take as much as you're willing to give it",5,4,5,5,5,5
" November 11, 2019",DevOps Engineer," Chantilly, VA ",Great place to work,"I enjoy working at BAH, the technology being used is cutting edge and management is great. I strongly recommend anyone that is looking for employment to look at Booz Allen Hamilton.",5,5,5,5,5,5
" November 10, 2019",Senior Manager," Washington, DC ",Self Directed Career,Plentiful junior to mid roles. Education opportunities exist and employees must take advantage to advance. Both internal and external skill building -- including key partnerships with technical certifications and leadership education. People are the best part of the job.,3,3,3,3,3,4
" November 7, 2019",Business Analyst," Chicago, IL ","Champagne taste, beer budget",These are the words I hear over and over again and while we told it to clients it felt like it applied to ourselves more. I found that management had a champagne taste but a beer budget and often the lower level team members would pay for that while extra hours or bearing the brunt of an upset client.,3,3,3,2,2,1
" November 7, 2019",Senior Associate," McLean, VA ",Used to be wonderful,"This company is not what it used to be. Trustworthy management is rare. They wear out their good people and many are going through the revolving door, despite all of the internal campaigns that give no more than lip service to employees' value and the company core values. Raises and promotions are abysmal while increases in benefit costs passed on to the employees are quite large - all the while keeping benefits to a minimum. Just because they check all the benefit type boxes does not mean they are quality benefits. 401k match mediocre; health benefit plan is a high deductible plan and Aetna will do everything in its power to not pay for any special or out of network expenses despite what is written in the plan unless you make another full time job of escalations and letter writing campaigns. The work is usually high pressure/pace, priorities illogical, and you will not actually be changing the world despite their glossy campaigns to the contrary.",2,3,3,1,1,1
" November 6, 2019",Lead Associate, Telework ,Workplace Culture,"Be prepared to bring your A game. It is an extremely competitive atmosphere. But the reputation of the firm as an industry leader is because fo the quality of their staff. They hire the best, and expect the best from you.",4,4,4,4,4,4
" November 5, 2019",Field System Engineer Lead Technologist," Fort Gordon, GA ",Na,One of the better companies I have ever worked for. I would reccomend working for Booz Allen Hamilton to anyone that likes to balance work and home life.,5,0,0,0,0,0
" November 5, 2019",Summer Games Intern," Alexandria, VA ","Great work environment, but managers provided little oversight","Great work environment, but managers provided little oversight. We were very behind on our work schedule and the managers were working far away and failed to identify why we were not making deadlines.",3,0,0,0,0,0
" November 2, 2019",Information Security Analyst," MacLean, VA ",nice place to work,"nice place to grow carrier nice place to work good work ethics
HR must learn to contact workers when managers make complains about their subordinates. Some managers are so power conscious that they do not have the employee interest at heart",3,3,3,3,2,2
" October 29, 2019",Administrative Specialist," Panama City, FL ",Watch your back,You had to watch your back. Senior Management NEVER back their employees. PROFIT FIRST - Employees Last on the list. They did not care about the Customers,1,1,1,1,1,1
" October 24, 2019",Data Science Intern," Washington, DC ",Great place to work.,"Great place to work. Consultant work, with different organizations. Biggest government contractor. Dress code not clear, but preference over formal and business casual.",4,4,4,4,4,4
" October 24, 2019",Lead Associate," Rockville, MD ",Great Benefits,"Booz Allen Hamilton is a good company to work for but lacks the leadership needed to keep talented employees. Should focus more on the career needs of employees, but the leadership is slammed with work and building business it can't focus on its talent.",3,4,4,3,3,3
" October 22, 2019",Sr. Network Engineer, Contractor for US NAVY NAVWAR ,Booz Allen Hamilton,"Booz Allen Hamilton has a great team environment, there does not seem to be the separation between teams that you find in other companies. The attitude within Booz Allen Hamilton is amicable and congenial, it's a friendly atmosphere.",5,5,4,3,5,3
" October 22, 2019",Lead Associate," Fort Meade, MD ","Good, solid place to work","They tell you they hire for a career and not for a specific contract. And they keep their word. I worked on a contract that was lost to a competitor and Booz found new positions for nearly everyone who wanted to stay with the firm. Pay is competitive, not great. Same with benefits.",4,5,3,4,5,5
" October 18, 2019",Lead Associate - Cyber Hunt & Incident Response Lead, Cyber Hunt & Incident Response Lead (Current Employee) ,Great place to work!,"I liked everything about BAH. Company, culture, salary, benefits, all of it.
But they never won the cotract I was hired for.
Would consider going back if an opportunity came up.",5,5,4,4,4,5
" July 20, 2020",Senior Data Scientist," Tysons Corner, VA ",Work culture is pretty toxic,"Work culture is pretty toxic. Junior staff are asked to put in extra hours but not allowed to bill overtime. Once you get to management, you have to be over 80% utilized in addition to putting in weekend hours to fulfill business development requirements.",4,4,3,3,3,3
" October 10, 2019",Summer Games Intern," Annapolis Junction, MD ",Very cool people but slow paced work,"very fun to work there, but the work is government work and the government is slow. The hardest part of the job was passing the time between asignments",4,5,5,5,5,2
" October 9, 2019",Vulnerability Management Lead," Arlington, VA ",Great place to expand and branch out to try new things.,"After telling my upper management I would like to change my position, everyone was on board and helped me find a new position wherever I wanted to go that they had offices.",4,4,3,4,5,5
" October 8, 2019",Communications/Telecommunications Engineer," Annapolis Junction, MD ",Great environment for the aspiring adult.,Working the government contracts with Booz Allen was great. Communication with the customer was seamless. The customer was always available to answer any questions.,5,5,5,5,5,5
" October 4, 2019",OPERATIONS EXECUTIVE," Honolulu, HI ",Broad focus of company activities,"Leading provider of management and technology consulting services to the U.S. government in the defense, intelligence, and civil markets.

Booz Allen has been empowering people to change the world for more than 100 years. Through our BE3 promise, we empower our employees to be their best selves, to live our purpose and values, and to create a career and life that’s meaningful to them.",4,4,4,4,4,4
" October 3, 2019",Associate," Fort Shafter, HI ",Interesting job,Booz | Allen | Hamilton offers a great benefits package. Typical day at work is 8 hours. The atmosphere within the workplace is great. The hardest part of the job is learning the new organizational structure.,5,5,5,5,5,5
" October 3, 2019",Senior Consultant/Risk Analyst," Colorado Springs, CO ",Fantastic Company,"The People at Booz Allen are of the highest quality. However, experiences my differ. I have loved my time at Booz Allen and would always be open to working for them.",4,0,0,0,0,0
" October 2, 2019",Project Analyst," Patuxent River, MD ",Overworked and Underpaid,"I spent 3 years with BAH and during that time witnessed terrible management and issues when the company went public. The project I was assigned to lost its contract on my second day. Luckily there was another position for me, but others were laid off. Vacation days, education assistance, and floating holidays were slashed withing my first six months. People were getting laid off left and right as the company lost clients. The clients treated employees very poorly and the company did nothing about this. Repeatedly worked 10+ hour days with no additional compensation, not even with travel. When I left the company I received a 20% raise just to get my pay on a comparable scale with others in the local area.",1,1,1,2,2,2
" October 2, 2019",Project Coordinator," New Orleans, LA ",Excellent team and company,My overall experience was great and i would love to reconnect with the company in the near future if an opportunity becomes available. The overall work atmosphere was family oriented and team building at its best!,5,5,5,5,5,5
" October 1, 2019","Software Engineer, Systems Administrator"," Panama City, FL ",Great company for Contract work,"Fairly secure positions. If the contract is lost for whatever reason, they'll try to keep you working. Great benefits package, but I wish their pay raises made sense. I don't feel that my pay is commensurate with the position. Trying to get them to come off the money is like pulling teeth.",4,4,4,4,4,4
" September 30, 2019",Orientation Specialist," McLean, VA ",Nice Place,"Great people to work with, Booz Allen has many offices, so all locations differ depending on which one you work at. Great benefits ""PTO"" and promotional opportunities.",4,4,3,3,2,3
" September 29, 2019",Reverse Engineering Intern," Fort Meade, MD ",Summer Games Intern,"Good culture, good people, chill with foosball and nice office building.
Projects can be boring and have no real effect within company. Presented to leadership at the end.",4,5,3,4,4,5
" September 28, 2019",Associate," Norfolk, VA ",Productive place to work,"When I joined the company, it was a clear meritocracy. They had stated metrics that dictated promotions and raises, and performed 360-degree annual reviews. Additionally, they would regularly keep someone on administrative charge numbers in between projects instead of letting them go and hiring them back (a practice common with other government contractors). Over the last 3 years, the changes that have occurred regarding the assessment and promotion processes has led the results to be subjective, with poor management and lack of leadership being the result.",3,3,4,2,2,3
" September 27, 2019",Associate," Norfolk, VA ",Excellent Employer,"Great employer with a great culture. Collaborative, respectful, and innovative. They are gig in the military and technology markets, especially in Washington D.C. metro area. Very veteran friendly.",5,4,4,3,5,5
" September 27, 2019",Staff Engineer/ Sr. Consultant/ Staff Technologist," Lexington Park, MD ",No place for a Junior Engineer,No management and no support from lead supervisor on remote contracts or training! Was ridiculed for having hobbies different from everyone else and was talked down to during meetings where we were asked to collaboratively share ideas centered around solving software requirements for our contracts.,3,4,2,3,1,4
" September 27, 2019",Project Officer U. S. Army Reserve," Charlotte, NC ",Productive,"Great opportunity, Great supervision, very helpful co-workers,
I would recommend all interested person in employment to consider Booz Allen Hamilton. your decision will benefit you all through your career.",5,5,5,5,5,5
" September 26, 2019",Lead Associate," San Diego, CA ",Fun and exciting,Booz Allen Hamilton is a great workplace. A lot of innovation is being done at Booz on a daily basis. There is a huge surge of data science related careers.,5,0,0,0,0,0
" September 25, 2019",Lead Associate," Washington, DC ",Too much emphasis on Federal Government stifles flexibility and creativity,"Booz Allen is home to a lot of smart, qualified people. However, about 95%+ of the work is with the Federal Government and the firm has started to increasingly align its culture, practices, and structure with the Federal Government - the same Federal Government we are hired to try to help/fix. Lots of ""butts in seats"" work with little creativity or critical thinking and a hyper-risk averse environment that micromanages and kills good ideas reflexively. The brand seems to be slowly decaying away as we look for way to squeeze more money out of the government without fixing the underlying issues of incompetence, laziness, bureaucracy and cronyism. Benefits used to be top shelf - now they have marched to the middle. Not terrible but not at the gold standard we once had.",3,3,3,3,2,2
" September 24, 2019",Data Scientist," Chantilly, VA ",Phenomenal contractor and consulting firm,"So far in my professional career, BAH is the best big company I've ever worked for. Their company structure is fluid, meaning organizational changes are somewhat frequent, but the emphasis on personal growth and ability to switch programs within the company make it an amazing place to work",5,5,4,4,5,5
" September 23, 2019",Associate," Crystal City, VA ",Good place to work,Interesting work and smart co-workers. I enjoy being able to explore new opportunities within the firm. There are opportunities to work overseas as well.,4,0,0,0,0,0
" July 20, 2020",Senior Data Scientist," Tysons Corner, VA ",Work culture is pretty toxic,"Work culture is pretty toxic. Junior staff are asked to put in extra hours but not allowed to bill overtime. Once you get to management, you have to be over 80% utilized in addition to putting in weekend hours to fulfill business development requirements.",4,4,3,3,3,3
" September 19, 2019",Subcontracts Lead," Norfolk, VA ",No work life balance,"Too much work, too little staff. All decisions are made at the management level. No support for those doing the work on a daily basis. Communication is poor.",3,1,4,3,1,3
" September 18, 2019",Consultant, Virginia ,BAH is a great company. One of the few who is actually living their values.,"Management is great at communicating and splitting up the work. Collaboration is also highly encouraged. The work/life balance is great as well. As long as you get your job done, they will trust you to do it how you like.",5,5,5,5,5,5
" September 17, 2019",Project Manager," McLean, VA ",People oriented,"Booz Allen was a great place to work. Focus is on people and they upper management was always available. They allow Flexible work hours and where available, even working remote.",5,4,4,4,3,3
" September 16, 2019",Training Coordinator, United States ,Review,BAH is a good place to work. The current contract provides for little advancement in my current location however and work life balance has been difficult achieve.,5,2,4,3,3,5
" September 14, 2019",Senior Business Consultant," San Antonio, TX ",Great place to work.,"The on-boarding process is very detailed and fast paced. This is an excellent place to work and play. You are given the opportunity for training and to enhance your skills for advancement.

I will most likely seek employment with Booz Allen and Hamilton.",5,5,5,5,4,5
" September 12, 2019",Network and Cloud Architect," El Segundo, CA ",Comfortable Work Environment,"Fairly laid back fun place to work. Compensation is a little bit low compared to other companies, but the work life balance is excellent. Most people there are nice and helpful",3,5,3,3,3,3
" September 12, 2019",Chief Technologist," Alexandria, VA ",Great Company,Great company with a lot of room to move and grow. Very solid understanding of promotion potential and the ability to grow within the organization. A lot of groups to get involved in.,5,0,0,0,0,0
" September 12, 2019",Associate," Crystal City, VA ",Great place to work...,BAH provides an opportunity to use your existing skills as well as opportunities to enhance and learn new skills. They have an excellent training program and certification incentives.,4,5,4,3,3,5
" September 10, 2019",Analyst, District of Columbia ,Poor middle managment reflected by poor senior managment,"While the tools, programs, and resources to excel are in place, the middle managers lack the ability or will to implement the tools or the will to assist in the use of the tools. Focus on getting people to just fill a seat is wide spread, but preparation to help individuals be prepared for those positions is not a concern. A fear of losing the contract causes middle management and senior management to forget that those that work for them are their clients too.",1,1,3,2,1,1
" September 10, 2019",Associate," Washington, DC ","Great to Start, but likely to burn out","Booz Allen is a great place to learn foundational consulting best practices. The higher you climb in the company, the more political it becomes. It is recommended to network as much as you can and take control of your career.",4,3,5,4,3,4
" September 10, 2019",Database Administrator," Herndon, VA ",Good place to work,Good place to work. Good cultural. Great management. Great work/life balance. Good benefits. Work culture is excellent! Good location. Good team work.,5,5,5,5,5,5
" September 7, 2019",SENIOR CONSULTANT, Notfolk ,Depends on leadership team,"I was on two different contracts with them. One contract's leadership was amazing, the other was horrible and threw me under the bus... no correct feedback, no honest, nothing.",3,5,3,2,1,5
" September 4, 2019",Summer Games Management Consulting Intern," Atlanta, GA ",Great Work-Life Balance,Great Work Life Balance but compensation is below industry standard which is expected because the majority of clients are federal. Very collaborative and supportive environment.,4,5,3,4,4,5
" September 2, 2019",Acquisition Project Manager," Lorton, VA ",No comment,I wish not to fill this out this survey. I just wanted my profile updated with my information. Having to complete this to move forward is not necessarily the best way to get positive feedback.,3,3,3,3,3,3
" August 31, 2019",Associate," McLean, VA ",Atmosphere,One of the best atmospheres I have worked in. Managment goes out of there way to make sure that each person is the right fit for the company. Not only do they care about you but also your family.,5,5,4,4,5,5
" August 29, 2019",Consultant," McLean, VA ",Document your own work performance and remain professional.,A rather competitive place to work at depending on the client you're supporting. Be professional and highly assertive while working for their client(s).,4,3,4,2,3,4
" August 26, 2019",Associate," San Diego, CA ","Excellent, wish I never left","Everything at Booz Allen Hamilton is amazing. Worked there for ten years, should have never left, want to return under the Alumnus program but it seems as if they don't want me as much as I want them back as my employer.",5,5,4,5,5,5
" July 20, 2020",Senior Data Scientist," Tysons Corner, VA ",Work culture is pretty toxic,"Work culture is pretty toxic. Junior staff are asked to put in extra hours but not allowed to bill overtime. Once you get to management, you have to be over 80% utilized in addition to putting in weekend hours to fulfill business development requirements.",4,4,3,3,3,3
