date,employee_title,location,review_title,Review,rating_overall,rating_balance,rating_benefits,rating_job_security,rating_management,rating_culture
" February 17, 2020",Financial Audit Support Analyst," Indianapolis, IN ",Being productive,"My current position I am Senior Analyst, I enjoy working with my team mate, training new employees whom has started with the company. Making sure they receive all their accesses to be productive.",4,4,4,3,3,3
" February 17, 2020",Senior Associate," McLean, VA ",Toxic culture,"The firm has an overall toxic and demeaning culture. Employees are worked into the ground and turnover is extremely high. Management only pays lip service to company core values. Many leaders are solely concerned with “managing up” via brown-nosing and manipulation, rather than supporting, empowering or developing their teams.",1,1,2,1,1,1
" February 16, 2020",Senior Manager," Washington, DC ",A reputable company undergoing constant transformation,"Overall, the company has a strong work culture that respects work-life balance and professional development. However, while the benefits packages are comparable to other firms, overall compensation is mid to lower than industry average. Furthermore, there are unclear paths to progression/ promotion and frequent transformation means employees are frequently starting from scratch in building their business case for higher opportunities. Plus, leadership development tends to be based more on relationships that work productivity. It's a meritocracy until it's not.",3,4,3,3,3,4
" February 14, 2020",General Management Consultant," Falls Church, VA ",Have a “Get Out” strategy,"I experienced a “company first, client second” mentality that lead to conflicts of interest and unethical consultant-client relationships that ultimately made my workplace toxic when I spoke up. It was a high stress environment with little work-life balance. Management was often untrained on how to mentor and support entry-level staff green from college, such as myself. I did learn how to be pessimistic though, from my time working there.",1,1,1,2,2,1
" February 12, 2020",Cyber Discovery Analyst," Hamilton, BM ",Great company to work for,Great people and great benefits. The culture promotes working hard but also learning from senior level teammates. Career and job managers are also there to ensure you are put in a position to succeed.,5,5,5,4,4,5
" February 11, 2020","Liaison Officer/CUAS Training Analyst, Global Threat Mitigation Program"," Hamilton, BM ",Excellent,"I have nothing bad to say about Booz, Allen Hamilton. They are a world-class organization. They do everything they can to ensure a professional work environment. They also value their employees more than any other company I have worked with.",5,5,5,5,5,5
" February 11, 2020",Lead Associate," Washington, DC ",Work/life Balance,"People understand that you have a life outside of the office and it is accepted.

I also appreciate not having to make up excuses to perform mundane life tasks outside of the office.",3,3,3,3,3,3
" February 10, 2020",Technologist," Arlington, VA ",n/a,A typical day depends on whether or not you have a clearance and contract. Most contracts needs clearances at booz allen but it is a great company to work for!,3,4,4,4,4,3
" February 9, 2020",Business Analyst," McLean, VA ",Booz Allen Hamilton,"Booz Allen Hamilton works with numerous government agencies. Not many opportunities for commercial work, you have to want to work at government offices.",3,0,0,0,0,0
" February 9, 2020",Digital Systems Administrator/Engineer," Belcamp, MD ","Bureaucratic in nature, but worth the experience","This is not like the normal places you have worked before. There are substantial reasons why someone just starting out or around the middle of their career will work here. You will gain experience at an extremely rapid rate. This also means you will work your tail off doing so. If you want to push your career to the next level and not worry about job security, then work here. Even though this is a contracting company, they will never drop you if the contract dries up (yes I am speaking from experience). They will keep you working on other things until they find another contract for you to work on.",5,5,5,5,5,5
" February 5, 2020",SECURITY ANALYST," Bethesda, MD ",Great company to work for,Great starter company to gain experience and grow. Booz Allen Hamilton continues to challenge their employees to be the best professionals and leaders possible.,4,4,3,3,3,4
" February 5, 2020",Intern," Washington, DC ",Great work/life balance,"I had charismatic managers who cared about the work, and weren't obsessed with moving up the corporate ladder. They encouraged work/life balance and were great examples of the practice in their daily lives.",5,5,5,5,5,5
" February 4, 2020",Associate," Red Bank, NJ ",Get experience and jump,"Very poor management and growth opportunities, long hours and little recognition. Very little work life balance. There are much better companies and work for what you get paid",3,2,2,1,2,2
" February 3, 2020",Cybersecurity Engineer," Fort Belvoir, VA ",Overall Very Good Company But Don't Get caught On A Bad Project,"The company itself is very good to work for and they make you feel great, but if you are on a bad contract/project like I currently am, you will have some trouble. I feel that I am on a contract that Booz Allen is just trying to fill out with whomever they can. I have voiced my displeasure with the situation and mostly just get people talking me down. The company as a whole is great but some of the contracts can put you in a bad spot.",3,5,5,5,2,5
" February 2, 2020",Project Analyst," Huntsville, AL ",Looking for a job while employed,"BAH has a weird concept where you will be paid, but if you don't have 100% billable hours, you need to start looking for a job within the company. The worst part about this concept is that the manager running the project doesn't always tell you if you're about to lose hours.",3,3,4,2,3,3
" January 30, 2020",Senior Network Engineer," San Diego, CA ",Good place to work if you get on the right team under the right management,Great place to work if you work for good team and management. Benefits and compensation are average and could be improved. It is contract work so be prepared to jump between contract.,3,3,3,3,3,3
" July 20, 2020",Senior Data Scientist," Tysons Corner, VA ",Work culture is pretty toxic,"Work culture is pretty toxic. Junior staff are asked to put in extra hours but not allowed to bill overtime. Once you get to management, you have to be over 80% utilized in addition to putting in weekend hours to fulfill business development requirements.",4,4,3,3,3,3
" January 30, 2020","Automation Tester, Consultant"," Washington, DC ",Good place to start out,"Its a great place for a recent graduate. Like many people say this place is a stepping stone. However, I have heard they're trying to cut costs ever since going public so their first offers to recent college graduates aren't the best in the industry.",4,4,2,3,4,4
" January 29, 2020",Federal Project Manager," Washington, DC ",High Bar,Commitment to excellence and culture focused on professionalism and hard work. My colleagues are some of the hardest working and intelligent practitioners in strategy consulting.,4,3,5,4,5,5
" January 28, 2020",Lead Geospatial Analyst/Data Scientist," Buckley AFB, CO ",Job Security,"Job security is a concern for Booz Allen. Ended a current job, booz allen kept me on till I found billable work. This kept me employed for 4 months....",5,5,5,5,5,5
" January 27, 2020",Leead Tech," Newport, RI ",Worst company to work for,Promisong things they can't deliver. Goating employees to work overtime and not pay them. Never get a day off. Constantly expect girl GB thing smony emploees.,1,1,1,1,1,1
" January 27, 2020",Senior Manager/Leader, Georgia ,Senior Leaders are Focused on Themselves,"Self Explanatory...
The senior leaders are more focused on getting promoted and moving ahead than they are in assisting staff to meet mission requirements. With this, the senior leaders put administrative burdens on the staff (of which most have no influence or impact other than causing extra/non-productive work for staff.",3,3,4,2,1,3
" January 27, 2020",(Lead Associate) Senior Program Manager," Albuquerque, NM ",Productive environmet to work in.,Support various Air Force programs at Kirtland Air Force Base. The individuals that work for Booz Allen all have various degrees and support numerous areas.,3,3,3,3,3,3
" January 26, 2020",Product Manager," Washington, DC ",Productive fun place to work,Great place to grow a career and learn about contracting. Good for networking and expanding what you know about I would recommend for almost anyone in the D.C. area.,4,4,3,4,4,3
" January 25, 2020",Geospatial Analyst," Arlington, VA ",Client relationship can be very rewarding,Customers are great. Being client-side if wonderful. Your work is highly valued and you can make a lot of difference if you work for it. Working remote can be isolating and frustrating.,4,3,2,3,3,4
" January 24, 2020",Project Manager," Arlington, VA ",Cutthroat,"Basically requires people to function as robots. Very tense working environment, almost toxic. Not a good place for people who like to smile every once in a blue moon. Management has no clue what their people do and offers no clear training or guidance.",1,2,2,1,1,1
" January 22, 2020",Team Lead/Supervisor," Lorton, VA ",Typical Consulting Firm,"As with any large consulting firm, it has positives and negatives. A positive is that the firm will do everything it can to keep you employed, even if the contract you support is terminated or there isn't enough work for you to do on that contract. A negative is that the firm is notorious for underpaying its employees relative to peers in other firms.",3,4,3,3,3,3
" January 22, 2020",Associate-Division Contract Lead,Division Contract Lead (Current Employee) ,Productive Fun Workplace,Absolutely the best company I have worked for. I have been given increased levels of responsibility and I love working for a Company that provides a culture and great opportunities to grow,5,5,5,5,5,5
" January 20, 2020",Consulant," Charleston, SC ",Great Company Overall,"Lots of red tape to get things done for your client since the majority of their clients are government clients. They expect you to find and create work for Booz Allen constantly no matter what, or how long you have been working with the client. For what is expected out of you, you are underpaid.",4,0,0,0,0,0
" January 19, 2020","Senior Disability and Health Program Workforce Capability, Lead"," McLean, VA ",work life balance,"Booz Allen is a great place to work and work life balance is very important. Diversity, career mobility, entrepreneurship are also important keys to success.",5,5,5,5,5,5
" January 19, 2020",All Source Intelligence Analyst," Reston, VA ",Professional,"This company is wonderful to work for. There is ample room for advancement, and the work is meaningful and important. The compensation is also extremely competitive, and among the best in the field.",5,5,5,5,5,5
" January 16, 2020",Systems Engineer," McLean, Va ",Great Place To Work,Company provides numerous resources to its employees. Education benefits are easy to find and access. Booz Allen facilitates courses to obtain certifications or at the very least helps pay for outside courses. My team is filled with experienced and skilled individuals whom I have learned a lot from. Definitely a place where I can see myself for awhile.,5,5,5,4,4,4
" January 15, 2020",Master Planner and Scheduler," Eglin AFB, FL ",Postive memories of my time at BAH. ( I retired in 2017),"BAH does very important work for the US Government in general, and the Air Force in particular. The company helped me in every way to provide good results to the government.",5,5,5,5,5,5
" January 13, 2020",Associate," Houston, TX ",Established Consulting Firm,"Booz Allen Hamilton is an established consulting firm that has supported the US government and commercial companies across the globe. It has a diverse workforce that is becoming specialized in data analytics, software development and AI.",4,4,4,4,4,4
" January 13, 2020",Discovery Analyst," Fort Gordon, GA ",Great Experience,From the very beginning I have felt fully supported by the company. From pay and benefits to chances for training and my own advancement. There are clear paths of advancement for anyone willing to work for it.,5,5,5,5,5,5
" January 11, 2020",Support Staff," Herndon, VA ",Treats Employees well,"Very nice employees, very accommodating and courteous. Sometimes there is little to no communication from supervisor. Lots of learning potential, and treat permanent employees very well, can be very long and often never become permanent.",4,5,5,3,4,4
" January 10, 2020",AiOps / Big Data Engineer," Charleston, SC ",Hard to navigate appropriate channels.,Hard to navigate appropriate channels. Easy to get lost and collect a paycheck. Which could be good if that is what you are looking for. There multiple opportunities to join new projects.,3,4,4,4,2,2
" July 20, 2020",Senior Data Scientist," Tysons Corner, VA ",Work culture is pretty toxic,"Work culture is pretty toxic. Junior staff are asked to put in extra hours but not allowed to bill overtime. Once you get to management, you have to be over 80% utilized in addition to putting in weekend hours to fulfill business development requirements.",4,4,3,3,3,3
" January 8, 2020","Business Analyst, Finance, Energy, Economic and Development"," Washington, DC ",Good stepping stone in your career,"Great culture, however, you do not necessary get the grow within your position much. Also company needs better pay. But great place to start your career.",2,0,0,0,0,0
" January 7, 2020",Software Engineer," Washington, DC ",Apathy & Mediocrity,"I'll give you an example of the treatment you can expect here:
- if you win a hackathon, someone from the company will call it a ""Booz Allen win"" and fail to give you credit.
- if you pitch an idea, someone will take credit for it and you'll never get time to work on it. No one will believe you came up with it, no one will show respect for you, no one will ask if you have other ideas, no one will offer help finding a position that would allow you to work on your ideas, no one will offer help finding resources outside the company to enable you to work on your ideas, there will just be no response & eventually you'll notice someone else stole your idea and implemented a terrible version of it that missed the point of the invention.
- There is no support for inventors. There is, however, ridicule for people with any ideas at all, let alone excellent ideas, because their business model rewards lying to government agencies to get contracts, and then executing the terrible unnecessary projects detailed in the contracts. They do not reward innovation or intelligence. Stay away unless you're desperate for a job.",1,1,1,1,1,1
" January 6, 2020",Sr. Consultant," Herndon, VA ",Greate Company to work for..,Greate company with greate work environement and people to work with. A bit difficult to find projects sometimes. Managment can more understadning and seek employee feedbacks.,4,4,4,4,4,4
" January 1, 2020",Associate," Salt Lake City, UT ",Difficult to maintain position with the company,"The most difficult aspect of my job was finding new projects to get included and maintain productive, billable hours. Once my team started streamlining the audit process there were less workable hours.",4,4,4,4,4,4
" December 30, 2019",Cloud Operations & Engineering Manager," Fairfax, VA ",good salary and benefits,"Awesome coworkers, good salary and benefits ($$ for education/trainings/conferences), stock purchase program, 401k match, lots of resources for wellness and discounts. Hard work is rewarded with salary increases and promotions.",1,1,1,1,1,1
" December 28, 2019",Associate," Honolulu, HI ",You Have To Be Agile at Booz Allen,"They don't hire just anyone for the job. They make a strong effort to find the right fit for the person and the client. Expect to be moved to other tasks that you weren't hired for, if your contract ends. However, they make a strong effort to keep people and if you have broad skills, they have A LOT of contracts to work on. Never a dull day, but you will learn a lot.",5,4,3,4,4,5
" December 28, 2019",Senior Financial analyst (Public trust clearance)," McLean, VA ",Productive and fun place to work,A GOOD PLACE TO WORK ESPECIALLY IF YOU LIKE A DIVERSE POPULATION. I can strongly recommend it to people or candidates with a good background in consulting.,4,4,5,4,4,4
" December 27, 2019",SENIOR CYBER SECURITY POLICY & COMPLIANCE ANALYST," San Antonio, TX ",Challenging conflicts between multiple divisions,Be prepared for multiple company divisions potentially interfering with your projects.Many of the projects have been stalled for this reason. Several good business friendships have resulted.,3,3,3,2,2,2
" December 27, 2019",Lead Associate," O'Fallon, IL ",Excellent Company,Booz Allen has many contracts within the federal government which allows it to remain diverse in its s as abilities to support the nation. Excellent company to work for as there are many opportunities.,5,4,4,3,3,4
" December 23, 2019",Business Operations Analyst," Houston, TX ",Work Place culture,The company does an outstanding job at promoting wellness programs. You are more than just an employee to this company and they have a great compensation and benefits program.,5,5,4,3,5,5
" December 23, 2019",LEAD ASSOCIATE," Washington, DC ",Great company with opportunity for growth,"Great company with opportunity for growth. Like many places networking is the key to success. Plenty of opportunity to grow new skills and move laterally. Individual experience is largely dependent on project team, client, and manager.",4,5,4,4,4,4
" December 21, 2019",Lead UX Designer," Washington, DC ",It's an alright place,"Great for different projects and teleworking options, but advancement opportunities are sometimes hard to come by. Some government contract work can also be very slow at times. Being in the creative space it also has a good amount of restrictions.",3,3,3,3,2,3
" December 21, 2019",Consultant/Contractor," Alexandria, VA ",Provides unique opportunities in a variety of workplaces,You have the chance to not only work for this company but you would also have the opportunity to work on client site for some the the most amazing and ground breaking companies in the country.,5,5,5,5,5,5
" December 19, 2019",Senior Consultant," San Antonio, TX ","Wonderful Place to Work, but...","Booz Allen is a great place to work, however there are no yearly bonuses, only recognition-based bonuses, so people who work with you can nominate you for a bonus. If you're hired at a certain salary, every year you get a review and that will set the yearly pay increase you get. So if you're hired at a low wage, it will take a very long time to get to the pay you'd like as you gain experience.",4,5,3,4,5,5
" December 16, 2019",Information Security Manager," Fort Gordon, GA ",great company,Booz Allen is a great company. I got the feeling this company REALLY cared about there people. Training was spot in and management was always available when needed.,5,5,5,5,5,5
" December 16, 2019","ANALYST, SENIOR CONSULTANT"," Aberdeen Proving Ground, MD ",Not the best place to work.,The work culture where I work treated contractors as if we were second rate citizens and Booze overlooked this for the sake of the almighty dollar. The culture is male top heavy and diversity only occurs at the lower level. If I had to do it all over again I would have picked the second job offer.,1,1,2,1,1,2
" December 16, 2019",Business Process Management and Administrative Specialist," Washington, DC ",Big Company,"They're cool. Has its ups and downs with any job, but the crowning achievement was how they took care of their employees during the furlough. We were the lucky ones who got paid and received assistance.",4,3,4,4,3,3
" December 15, 2019",Software Systems Engineer," Albuquerque, NM ",Manager was terrible,"Manager was terrible
I didn't learn anything
work was terrible
cubicles were terrible
most enjoyable was going home
Job was boring
Manager was terrible",2,2,2,2,1,2
" December 12, 2019",Senior Associate Consultant," McLean, VA ",Great Company; well respected!,"BAH had status, was respected, and had extremely competent professionals. It was a firm that others migrated to and wanted to join. Professionals/Clients within the IC trusted BAH to provide skilled educated professionals who they considered to be part of an integrated team and relied on to deliver actionable solutions for complicated intelligence challenging problems.",5,5,5,5,5,5
" December 11, 2019",Senior Consultant," Washington, DC ",False Advertising and Misplaced Priorities,"Booz Allen Hamilton lives off of an outdated reputation as a top consulting firm while primarily profiting from staff augmentation contracts with the federal government. The company's recruiting scripts blur the line between fact and fiction to attract talent that would otherwise decline. The cultural environment is bizarre; the company prioritizes social interaction among employees over producing high-quality work products for clients. The lack of honesty, transparency, and appropriate focus make for a less than tenable situation for those seeking a substantive and rewarding career platform. To make matters worse, the company selectively underpays new consulting staff. However, one can easily trade on the company's brand name to transition into better organizations.",1,1,1,1,1,1
" July 20, 2020",Senior Data Scientist," Tysons Corner, VA ",Work culture is pretty toxic,"Work culture is pretty toxic. Junior staff are asked to put in extra hours but not allowed to bill overtime. Once you get to management, you have to be over 80% utilized in addition to putting in weekend hours to fulfill business development requirements.",4,4,3,3,3,3
" December 11, 2019","Agile Transformation Coach, Technical Support"," McLean, VA ",Good trainings,Booz Allen provides good training opportunities to their employees but they lack the ability to place their employees into billable projects as and when they come on bench.,3,0,0,0,0,0
" December 11, 2019",Architecture and Engineering Integration Analyst," Alexandria, VA ",Excellent Company,"BAH is extremely loyal to the employee. They offer a return program to those employees who left for other opportunities. If you return within 5 years, you get to keep your tenure. TIP: Negotiate your salary well, they will low-ball you but they can afford to pay more.",5,5,5,4,5,5
" December 10, 2019",IT Scrum Master," McLean, VA ",great work culture,"Great working enviroment,good collaboration and determination on achieving goal. A fast pace work enviroment, highly inteactive. Cultural diversity highly encouraged. There is nothing hard about the job. Effective deliveries is an enjoyable moment on the job",4,4,4,4,4,4
" December 9, 2019",Senior Lead Technologist," Walker Ln, Alexandria VA ",Dynamic and personal work environment,Love the place and people. Mission is clear and leadership are engaging. Great place to find a work family. Tremendous opportunities to lead up and down.,5,5,5,3,5,5
" December 5, 2019",Executive Assistant - Global Mobility Specialist, Global Mobility Specialist (Current Employee) ,Overall a good firm,"The firm is a good place to work, the people are all welcoming and supportive, the salary is greatly matched to your role and skill level, telework available and work/life balance is considered. The only hiccup I have is when your manager leaves the firm it is up to you to find a new manager and if they are not hiring for the level of support, you are most likely reduction in force (RIF) .",3,4,4,2,2,4
" December 5, 2019",SENIOR ASSOCIATE," Colorado Springs, CO ",They'll take what you give,"Very supportive company - but will take all that you give. Work life balance exists if you're willing to fight for it. Compensation is good, benefits are average. Educational benefits are better than average for tenured employees.",4,3,4,5,4,4
" December 4, 2019",Associate," McLean, VA ",Experience depends on team,"Your employment experience heavily depends on your management team. If you have a supportive, well managed team, then your experience will be better than a dysfunctional team.",3,3,3,3,2,2
" December 3, 2019",Senior Consultant / Target Analyst Reporter," Augusta, GA ",Great job,I worked for Booz Allen Hamilton during a transition of contracts for them. During this time they supported me through offering an on-boarding program like no other. They paid you to do their training and become oriented as part of the company. This is something I wish more companies did. The first two weeks of the job this is what you were scheduled to do.,4,4,4,4,4,4
" December 3, 2019",Associate," Washington, DC ","Good people, lots of bureaucracy","Very project-based consulting; I was on a completely new team every 6-12 months, which got a little lonely. You really have to be your own advocate and shouldn't assume that your superiors are pushing for you. Most people are super smart and good to work with.",3,0,0,0,0,0
" December 2, 2019",Senior Consultant," San Antonio, TX ",Another Big DoD contracting company after the bottom line,I'm sure BAH has some great people that want to provide excellent value to the client. My experience with BAH showed me a side of the company that was more concerned with making money than providing value to the client.,2,0,0,0,0,0
